{
  "system": "diagram-core-v1",
  "public_name": "AniDiagram Diagram Core Icon System v1.0",
  "catalog_revision": 3,
  "icons": [
    {"id": "user", "category": "actors", "semantic_kind": "user", "structural_prototype": "personal-user-request", "aliases": [], "parts": ["body", "profile", "head", "shoulders", "request-bubble", "indicator"], "supported_states": [], "supported_actions": ["receive", "request", "decide", "send"], "status": "approved", "asset_revision": 1},
    {"id": "developer", "category": "actors", "semantic_kind": "developer", "structural_prototype": "code-builder-console", "aliases": [], "parts": ["body", "person", "head", "code-panel", "code-mark", "indicator"], "supported_states": [], "supported_actions": ["receive", "build", "debug", "send"], "status": "approved", "asset_revision": 1},
    {"id": "operator", "category": "actors", "semantic_kind": "operator", "structural_prototype": "operator-console", "aliases": [], "parts": ["body", "shell", "head", "panel", "cursor", "indicator"], "supported_states": [], "supported_actions": ["receive", "operate", "confirm", "send"], "status": "approved", "asset_revision": 1},
    {"id": "agent", "category": "actors", "semantic_kind": "agent", "structural_prototype": "actor-character", "aliases": [], "parts": ["body", "shell", "face-screen", "eye-left", "eye-right", "mouth", "antenna", "core", "indicator"], "supported_states": [], "supported_actions": ["enter", "receive", "process", "send"], "status": "approved", "asset_revision": 2},
    {"id": "agent-team", "category": "actors", "semantic_kind": "agent-team", "structural_prototype": "coordinated-agent-cluster", "aliases": [], "parts": ["body", "leader", "member-left", "member-right", "link", "indicator"], "supported_states": [], "supported_actions": ["receive", "coordinate", "process", "send"], "status": "approved", "asset_revision": 1},
    {"id": "assistant", "category": "actors", "semantic_kind": "assistant", "structural_prototype": "service-assistant-bubble", "aliases": [], "parts": ["body", "shell", "service-core", "reply-tail", "sparkle", "indicator"], "supported_states": [], "supported_actions": ["receive", "assist", "respond", "send"], "status": "approved", "asset_revision": 1},
    {"id": "human-reviewer", "category": "actors", "semantic_kind": "human-reviewer", "structural_prototype": "reviewer-card-inspection", "aliases": [], "parts": ["body", "person", "head", "review-card", "lens", "indicator"], "supported_states": [], "supported_actions": ["receive", "inspect", "decide", "send"], "status": "approved", "asset_revision": 1},

    {"id": "ai-model", "category": "ai-models", "semantic_kind": "ai-model", "structural_prototype": "layered-model-core", "aliases": [], "parts": ["body", "shell", "layer-back", "layer-front", "core", "ports", "indicator"], "supported_states": [], "supported_actions": ["receive", "infer", "process", "send"], "status": "approved", "asset_revision": 1},
    {"id": "llm", "category": "ai-models", "semantic_kind": "llm", "structural_prototype": "language-context-stack", "aliases": [], "parts": ["body", "shell", "token-row", "context-band", "attention-path", "indicator"], "supported_states": [], "supported_actions": ["receive", "attend", "generate", "send"], "status": "approved", "asset_revision": 1},
    {"id": "neural-network", "category": "ai-models", "semantic_kind": "neural-network", "structural_prototype": "layered-neural-network", "aliases": [], "parts": ["body", "shell", "layer-a", "layer-b", "layer-c", "signal", "indicator"], "supported_states": [], "supported_actions": ["receive", "propagate", "activate", "send"], "status": "approved", "asset_revision": 1},
    {"id": "reasoning", "category": "ai-models", "semantic_kind": "reasoning", "structural_prototype": "branching-reasoning-path", "aliases": [], "parts": ["body", "shell", "premise", "path", "branch", "result", "indicator"], "supported_states": [], "supported_actions": ["receive", "decompose", "decide", "send"], "status": "approved", "asset_revision": 1},
    {"id": "embedding", "category": "ai-models", "semantic_kind": "embedding", "structural_prototype": "vector-mapping-space", "aliases": [], "parts": ["body", "input-card", "coordinate-space", "points", "vector", "projection", "indicator"], "supported_states": [], "supported_actions": ["receive", "map", "embed", "send"], "status": "approved", "asset_revision": 1},
    {"id": "memory", "category": "ai-models", "semantic_kind": "memory", "structural_prototype": "stacked-memory", "aliases": [], "parts": ["body", "shell", "drawer-top", "drawer-bottom", "card", "indicator"], "supported_states": [], "supported_actions": ["receive", "write", "recall", "send"], "status": "approved", "asset_revision": 1},
    {"id": "tool", "category": "ai-models", "semantic_kind": "tool", "structural_prototype": "pipeline-tool", "aliases": [], "parts": ["body", "shell", "handle", "mechanism", "core", "indicator"], "supported_states": [], "supported_actions": ["receive", "activate", "process", "send"], "status": "approved", "asset_revision": 1},
    {"id": "token", "category": "ai-models", "semantic_kind": "token", "structural_prototype": "metered-token", "aliases": [], "parts": ["body", "shell", "tick-group", "core", "indicator"], "supported_states": [], "supported_actions": ["receive", "count", "process", "send"], "status": "approved", "asset_revision": 1},

    {"id": "database", "category": "data-knowledge", "semantic_kind": "database", "structural_prototype": "stacked-storage", "aliases": [], "parts": ["body", "shell", "top-ring", "layer-top", "layer-middle", "layer-bottom", "core", "indicator"], "supported_states": [], "supported_actions": ["receive", "write", "index", "search", "send"], "status": "approved", "asset_revision": 2},
    {"id": "vector-database", "category": "data-knowledge", "semantic_kind": "vector-database", "structural_prototype": "vector-index-vault", "aliases": [], "parts": ["body", "shell", "layers", "points", "scanner", "indicator"], "supported_states": [], "supported_actions": ["receive", "index", "search", "send"], "status": "approved", "asset_revision": 1},
    {"id": "data-warehouse", "category": "data-knowledge", "semantic_kind": "data-warehouse", "structural_prototype": "aggregated-data-warehouse", "aliases": [], "parts": ["body", "shell", "roof", "bins", "door", "indicator"], "supported_states": [], "supported_actions": ["receive", "aggregate", "store", "send"], "status": "approved", "asset_revision": 1},
    {"id": "document-store", "category": "data-knowledge", "semantic_kind": "document-store", "structural_prototype": "document-drawer-store", "aliases": [], "parts": ["body", "shell", "drawer", "document-card-front", "document-card-back", "indicator"], "supported_states": [], "supported_actions": ["receive", "store", "retrieve", "send"], "status": "approved", "asset_revision": 1},
    {"id": "knowledge-base", "category": "data-knowledge", "semantic_kind": "knowledge-base", "structural_prototype": "linked-knowledge-cards", "aliases": [], "parts": ["body", "card-left", "card-center", "card-right", "links", "core", "indicator"], "supported_states": [], "supported_actions": ["receive", "organize", "retrieve", "send"], "status": "approved", "asset_revision": 1},
    {"id": "dataset", "category": "data-knowledge", "semantic_kind": "dataset", "structural_prototype": "mixed-card-container", "aliases": [], "parts": ["body", "container", "cards", "filter", "record", "indicator"], "supported_states": [], "supported_actions": ["receive", "filter", "sample", "send"], "status": "approved", "asset_revision": 1},
    {"id": "search", "category": "data-knowledge", "semantic_kind": "search", "structural_prototype": "search-instrument", "aliases": [], "parts": ["body", "lens", "handle", "scan", "target", "indicator"], "supported_states": [], "supported_actions": ["receive", "scan", "locate", "send"], "status": "approved", "asset_revision": 1},

    {"id": "file", "category": "files-content", "semantic_kind": "file", "structural_prototype": "folded-file-card", "aliases": [], "parts": ["body", "sheet", "fold", "content-line-top", "content-line-bottom", "indicator"], "supported_states": [], "supported_actions": ["receive", "open", "read", "send"], "status": "approved", "asset_revision": 1},
    {"id": "folder", "category": "files-content", "semantic_kind": "folder", "structural_prototype": "tabbed-file-folder", "aliases": [], "parts": ["body", "shell", "tab", "file-card", "file-line", "indicator"], "supported_states": [], "supported_actions": ["receive", "open", "store", "send"], "status": "approved", "asset_revision": 1},
    {"id": "document", "category": "files-content", "semantic_kind": "document", "structural_prototype": "text-document-file", "aliases": [], "parts": ["body", "page", "fold", "line-top", "line-middle", "line-bottom", "indicator"], "supported_states": [], "supported_actions": ["receive", "open", "read", "send"], "status": "approved", "asset_revision": 1},
    {"id": "pdf", "category": "files-content", "semantic_kind": "pdf", "structural_prototype": "paginated-pdf-file", "aliases": [], "parts": ["body", "page", "fold", "pages", "spine", "badge", "indicator"], "supported_states": [], "supported_actions": ["receive", "open", "page", "send"], "status": "approved", "asset_revision": 1},
    {"id": "image", "category": "files-content", "semantic_kind": "image", "structural_prototype": "image-preview-file", "aliases": [], "parts": ["body", "page", "fold", "preview", "scan-line", "badge", "indicator"], "supported_states": [], "supported_actions": ["receive", "open", "scan", "send"], "status": "approved", "asset_revision": 1},